
title,content,excerpt,tags
"Mindfulness Meditation: A Beginner's Guide","Mindfulness meditation is a practice that can help calm your mind and improve your overall wellbeing. This guide will walk you through simple steps to start your meditation journey.\n\nWhat is Mindfulness Meditation?\n\nMindfulness meditation is the practice of focusing your attention on the present moment, acknowledging and accepting your feelings, thoughts, and bodily sensations without judgment.\n\nHow to Begin:\n\n1. Find a quiet space where you won't be disturbed.\n2. Sit in a comfortable position with your back straight.\n3. Close your eyes and begin to notice your breathing.\n4. Focus on the sensation of your breath entering and leaving your body.\n5. When your mind wanders (it will!), gently bring your attention back to your breath.\n\nStart with just 5 minutes a day and gradually increase your time as you become more comfortable with the practice.","A simple guide to starting your mindfulness meditation practice for better mental health and stress reduction.",["mindfulness","meditation","beginner","wellness"]
"The Science of Happiness: What Research Tells Us","Recent scientific studies have uncovered fascinating insights about what truly makes us happy, and some of the findings might surprise you.\n\nThe Happiness Factors:\n\n1. Strong Social Connections: Research consistently shows that meaningful relationships are the strongest predictor of happiness.\n\n2. Gratitude Practice: Studies have found that people who regularly express gratitude experience more positive emotions and better health.\n\n3. Acts of Kindness: Helping others triggers the release of oxytocin and endorphins, creating a 'helper's high.'\n\n4. Physical Activity: Exercise releases endorphins that elevate mood and reduce stress hormones.\n\n5. Flow States: Being fully engaged in challenging but manageable tasks creates a sense of fulfillment.\n\nThe most interesting finding? Beyond a moderate income that meets our basic needs, more money correlates very little with increased happiness.","Discover what scientific research reveals about the true sources of happiness and wellbeing in our lives.",["science","happiness","psychology","wellbeing"]
"Digital Detox: Why Your Brain Needs a Break","In our hyper-connected world, giving your brain regular breaks from digital stimulation isn't just nice—it's necessary. Constant digital engagement is changing how our brains function, and not always for the better.\n\nSigns You Need a Digital Detox:\n\n- You check your phone within minutes of waking up\n- You feel anxious when separated from your devices\n- You have trouble focusing on non-screen activities\n- Your sleep quality has deteriorated\n\nBenefits of Digital Breaks:\n\n1. Improved attention span and deeper thinking\n2. Better sleep quality\n3. Reduced anxiety and stress\n4. Enhanced face-to-face relationships\n\nStart small: Try a 'tech sunset' by turning off devices 1-2 hours before bedtime, or designate certain meals or weekends as 'screen-free' times.","How taking regular breaks from digital devices can improve your mental focus, sleep quality, and overall wellbeing.",["digital detox","mental health","technology","focus"]
"The Power of Habit: Creating Positive Change","Our lives are largely defined by our habits—those automatic behaviors we perform without thinking. Understanding how habits work is the first step to transforming your life.\n\nThe Habit Loop:\n\n1. Cue: The trigger that initiates the behavior\n2. Craving: The motivation or desire for change\n3. Response: The actual habit or action\n4. Reward: The benefit you gain from the behavior\n\nTo change a habit:\n\n- Identify the cue and reward\n- Substitute the response with a new behavior that provides a similar reward\n- Start extremely small to build consistency\n- Create an environment that supports your new habits\n- Be patient—research shows it takes anywhere from 18 to 254 days to form a new habit\n\nRemember that willpower alone often isn't enough; designing your environment for success is equally important.","Learn the science behind habit formation and how to harness it to create lasting positive changes in your life.",["habits","personal development","psychology","change"]
"Breathing Techniques for Stress Relief","Your breath is a powerful tool that's always available to help manage stress and anxiety. Different breathing techniques can activate different responses in your body.\n\nKey Breathing Techniques:\n\n1. Box Breathing: Inhale for 4 counts, hold for 4, exhale for 4, hold for 4. Repeat. This technique is used by Navy SEALs to remain calm under pressure.\n\n2. 4-7-8 Breathing: Inhale for 4 counts, hold for 7, exhale for 8. Great for falling asleep or calming anxiety.\n\n3. Diaphragmatic Breathing: Place one hand on your chest and one on your belly. Breathe deeply so that only the hand on your belly moves. This activates your parasympathetic nervous system.\n\n4. Alternate Nostril Breathing: A yogic practice that balances the left and right hemispheres of the brain and promotes mental clarity.\n\nPractice these techniques for just 5 minutes daily to see significant improvements in your stress levels.","Simple yet effective breathing exercises that can help reduce stress, anxiety, and promote a sense of calm and balance.",["breathing","stress relief","anxiety","relaxation"]
"The Benefits of Cold Exposure","Cold exposure might sound uncomfortable, but a growing body of research suggests it offers remarkable health benefits. From cold showers to ice baths, controlled cold exposure is gaining popularity.\n\nPotential Benefits:\n\n1. Reduced inflammation: Cold therapy can help reduce inflammation and alleviate symptoms of inflammatory conditions.\n\n2. Improved immune function: Regular cold exposure may increase white blood cell count and strengthen immune response.\n\n3. Enhanced mood: Cold exposure triggers the release of endorphins and noradrenaline, potentially alleviating symptoms of depression.\n\n4. Better circulation: The body's response to cold improves circulation as blood moves to vital organs and then back to extremities upon warming.\n\n5. Increased resilience: Regular practice helps build mental toughness and ability to handle stressors.\n\nStart small with 30 seconds of cold water at the end of your shower, gradually building tolerance over time.","Exploring the science behind cold therapy and how controlled cold exposure can benefit physical and mental health.",["cold therapy","health","wellness","resilience"]
"The Art of Deep Listening","In a world full of noise and distraction, deep listening has become a rare and valuable skill. It's not just about hearing words—it's about being fully present with another person.\n\nTrue listening involves:\n\n- Setting aside your own thoughts, judgments, and the urge to respond\n- Being curious about the other person's perspective\n- Noticing non-verbal cues and emotional undertones\n- Asking thoughtful questions rather than jumping to advice-giving\n- Creating a safe space for authentic expression\n\nThe impact of being truly heard is profound. It strengthens relationships, builds trust, resolves conflicts more effectively, and helps people feel valued and understood.\n\nDeep listening is not just a gift to others—it enriches our own lives by opening us to new perspectives and deeper connections.","How cultivating the skill of truly listening to others can transform your relationships and deepen your connections.",["communication","relationships","empathy","personal growth"]
"Finding Purpose in Everyday Life","Many of us think of purpose as something grand or dramatic—a calling that completely defines our lives. But purpose can also be found in the small, meaningful moments that make up our days.\n\nWays to cultivate everyday purpose:\n\n1. Connect small tasks to larger values. How does preparing a meal nourish those you love? How does your daily work contribute to something you believe in?\n\n2. Create meaningful rituals that provide structure and significance.\n\n3. Practice mindful attention to the present moment, fully engaging with whatever you're doing.\n\n4. Regularly help others in small ways—research shows that altruistic actions increase our sense of purpose.\n\n5. Reflect on what makes you lose track of time and find ways to incorporate more of these flow-inducing activities.\n\nPurpose isn't always about changing the world—it's often about changing moments through the quality of our presence and intention.","Discovering meaning and significance in your daily routines and small actions rather than waiting for a grand calling.",["purpose","meaning","mindfulness","everyday life"]
"Sleep Hygiene: The Foundation of Mental Health","Quality sleep might be the most underrated factor in mental health. While we often focus on therapy and medications, sometimes the most powerful intervention is improving our sleep hygiene.\n\nEffective sleep practices:\n\n1. Consistency: Go to bed and wake up at the same time every day, even on weekends.\n\n2. Environment: Keep your bedroom cool (65-68°F/18-20°C), dark, and quiet.\n\n3. Screen boundaries: Avoid blue light from devices at least 1-2 hours before bed.\n\n4. Mindful consumption: Limit caffeine after noon and alcohol before bed (which disrupts REM sleep).\n\n5. Wind-down routine: Develop calming pre-sleep activities like reading, gentle stretching, or meditation.\n\n6. Worry time: Schedule 15 minutes earlier in the day to write down concerns so they don't keep you awake.\n\nImproved sleep doesn't just reduce the risk of mental health issues—it enhances cognitive function, emotional regulation, and overall quality of life.","How establishing healthy sleep habits can dramatically improve your mental health, energy levels, and emotional resilience.",["sleep","mental health","wellness","habits"]
"Gratitude Journaling: Transform Your Outlook in Five Minutes a Day","The simple practice of writing down things you're grateful for can dramatically improve your mental health and happiness. Research shows that gratitude journaling can increase happiness by up to 25%.\n\nHow to start:\n\n1. Choose a time: Morning to set a positive tone for the day, or evening to reflect.\n\n2. Keep it simple: Write 3-5 things you're grateful for, from significant events to small pleasures.\n\n3. Be specific: Instead of \"I'm grateful for my friend,\" try \"I'm grateful that Sarah called to check on me yesterday.\"\n\n4. Focus on people: Expressing gratitude for relationships tends to be more impactful than material things.\n\n5. Notice new things: Challenge yourself to find fresh sources of gratitude each day.\n\n6. Include challenges: Sometimes our greatest growth comes from difficulties—can you find gratitude there too?\n\nThe key is consistency rather than length. Even five minutes a day can shift your brain's tendency to scan for negative information toward noticing the good in your life.","How the simple habit of recording what you're thankful for can rewire your brain for greater happiness and resilience.",["gratitude","journaling","positive psychology","habits"]
"The Forest Bathing Phenomenon","Forest bathing, or shinrin-yoku, originated in Japan in the 1980s as a cornerstone of preventive healthcare. It's not hiking or exercising—it's simply being present in nature using all your senses.\n\nScientific benefits include:\n\n- Reduced stress hormones (cortisol)\n- Lowered blood pressure and heart rate\n- Boosted immune function (increased natural killer cells)\n- Improved mood and reduced symptoms of depression\n- Enhanced focus and cognitive performance\n\nHow to practice:\n\n1. Leave your devices behind\n2. Enter the forest without a destination in mind\n3. Engage all your senses—notice what you see, hear, smell, feel\n4. Move slowly, allowing yourself to pause frequently\n5. Sit and simply observe for periods of time\n\nNo forest nearby? Studies show even urban parks, gardens, or views of trees can provide partial benefits.","Exploring the Japanese practice of forest immersion and its remarkable benefits for physical and psychological wellbeing.",["forest bathing","nature therapy","stress reduction","wellness"]
"The Surprising Benefits of Voluntary Discomfort","Voluntarily embracing discomfort—from cold showers to fasting to difficult physical challenges—might sound counterintuitive, but it's a practice with ancient roots and modern science to back it up.\n\nBenefits of controlled discomfort include:\n\n1. Increased stress resilience: Regular exposure to manageable stressors helps us handle life's inevitable difficulties.\n\n2. Strengthened willpower: Each act of voluntary discomfort strengthens your ability to override immediate impulses.\n\n3. Perspective shifts: Minor inconveniences that once seemed major become insignificant after embracing bigger challenges.\n\n4. Gratitude enhancement: Temporary discomfort makes you appreciate comfort more when you return to it.\n\n5. Self-efficacy: Proving to yourself that you can handle discomfort builds confidence in other areas.\n\nStart small with cold showers, skipping a meal, or even holding a difficult yoga pose a bit longer than comfortable. The point isn't suffering—it's growth through manageable challenges.","Why deliberately seeking out uncomfortable experiences can build resilience, willpower, and a greater appreciation for life.",["resilience","stoicism","personal growth","mental strength"]
"Authentic Relationships in a Digital World","Building and maintaining authentic connections has become both easier and harder in our digital age. While technology connects us across distances, it can also create barriers to deeper intimacy.\n\nNavigating this paradox requires:\n\n1. Quality over quantity: Focus on nurturing fewer, deeper relationships rather than maintaining hundreds of surface-level connections.\n\n2. Vulnerability courage: Share your authentic thoughts, feelings, and experiences rather than curated highlights.\n\n3. Digital boundaries: Create technology-free zones and times to allow for undistracted connection.\n\n4. Active listening: Practice being fully present without planning your response or checking notifications.\n\n5. In-person prioritization: While digital communication has its place, physically spending time together creates stronger bonds through shared experiences and nonverbal cues.\n\nRemember that authentic connection isn't always comfortable—it involves allowing yourself to be truly seen, with all your imperfections.","Strategies for developing meaningful human connections in an era where technology both connects and isolates us.",["relationships","authenticity","connection","digital wellbeing"]
"The Practice of Morning Pages","Morning Pages—three pages of longhand, stream-of-consciousness writing done first thing in the morning—were popularized by Julia Cameron in \"The Artist's Way\" but have benefits for everyone, not just artists.\n\nThis simple practice can:\n\n- Clear mental clutter and reduce anxiety\n- Bypass your inner critic and access deeper insights\n- Identify patterns in thinking and behavior\n- Solve problems more creatively\n- Create space between thoughts and reactions\n\nKey principles:\n\n1. Write by hand, not digitally\n2. Don't edit, censor, or worry about quality\n3. Keep writing even when you think you have nothing to say\n4. Don't share your pages with anyone\n5. Commit to the process for at least 30 days\n\nMany practitioners find that Morning Pages not only enhance creativity but also serve as a powerful tool for emotional processing and personal growth.","How the simple habit of writing three pages every morning can unlock creativity, clarify thinking, and transform your relationship with yourself.",["morning pages","creativity","journaling","personal growth"]
"Understanding Your Body's Stress Signals","Our bodies often recognize stress before our conscious minds do. Learning to read these early warning signals can help you intervene before stress becomes overwhelming.\n\nCommon physical stress indicators:\n\n- Tension in the jaw, neck, or shoulders\n- Changes in breathing patterns (shallow, rapid breathing)\n- Digestive issues (stomachaches, appetite changes)\n- Sleep disruptions\n- Increased heart rate or blood pressure\n\nMental/emotional signals:\n\n- Racing thoughts or difficulty focusing\n- Increased irritability or impatience\n- Anxiety or feeling overwhelmed\n- Decision fatigue or procrastination\n- Social withdrawal\n\nWhen you notice these signals, respond with targeted interventions:\n\n- For physical tension: Progressive muscle relaxation or gentle stretching\n- For shallow breathing: Diaphragmatic breathing exercises\n- For racing thoughts: Mindful observation or journaling\n- For emotional reactivity: Brief meditation or time in nature\n\nThe earlier you catch these signals, the more effectively you can manage stress before it impacts your health.","Learn to recognize and respond to your body's early warning signs of stress before they develop into more serious health problems.",["stress management","body awareness","self-care","health"]
"The Creative Power of Walking","Walking isn't just good for your physical health—it's a powerful catalyst for creativity and mental clarity. Throughout history, great thinkers from Aristotle to Darwin to Steve Jobs have used walking as a tool for thinking.\n\nResearch has found that walking:\n\n- Increases creative ideation by up to 60%\n- Improves divergent thinking (generating multiple solutions)\n- Enhances problem-solving abilities\n- Reduces mental fatigue and restores attention\n\nTo leverage walking for creativity:\n\n1. Walk alone if possible\n2. Leave devices behind or put them on \"do not disturb\"\n3. Consider walking in nature for added cognitive benefits\n4. Don't force solutions—allow your mind to wander\n5. Bring a small notebook or use voice memos to capture insights\n\nWhether it's a 10-minute stroll or a longer excursion, walking provides the perfect balance of gentle physical activity and mental space for insights to emerge.","How the simple act of walking can boost creative thinking, problem-solving, and mental wellbeing.",["creativity","walking","thinking","productivity"]
"Mindful Eating for Better Health","In a culture of eating on the go, in front of screens, or while multitasking, mindful eating offers a radically different approach to nourishment. It's about bringing full awareness to the experience of eating.\n\nPracticing mindful eating involves:\n\n1. Engaging all senses: Notice colors, smells, textures, flavors, and even sounds of your food.\n\n2. Removing distractions: Turn off screens and focus on the meal experience.\n\n3. Eating slowly and chewing thoroughly: Aim for 20-30 chews per bite.\n\n4. Checking in with hunger cues: Pause mid-meal to assess fullness.\n\n5. Expressing gratitude: Consider everyone involved in bringing the food to your table.\n\nBenefits include better digestion, greater satisfaction from smaller portions, reduced emotional eating, and a healthier relationship with food. Even practicing for just one meal a day can begin to transform your eating habits.","How bringing full awareness to the experience of eating can transform your relationship with food and improve digestion.",["mindful eating","nutrition","wellness","mindfulness"]
"The Power of Play in Adult Life","Somewhere along the path to adulthood, many of us lose touch with the vital importance of play. Yet research shows that playfulness remains essential throughout life for creativity, stress reduction, and social bonding.\n\nAdult play might look like:\n\n- Physical activities done for joy rather than exercise (dancing, recreational sports)\n- Creative expression without concern for outcomes (art, music, writing)\n- Exploration and curiosity (learning new skills without pressure)\n- Humor and lightheartedness (jokes, silliness, laughter)\n- Games and friendly competition\n\nThe benefits extend far beyond momentary enjoyment:\n\n- Reduced stress and increased positive emotions\n- Enhanced problem-solving abilities\n- Improved relationships and social skills\n- Protection against burnout\n\nThe key is finding forms of play that genuinely engage you rather than activities you think you \"should\" enjoy. What made you lose track of time as a child? That might hold clues to the types of play that would resonate with you now.","Why maintaining a playful spirit isn't childish but essential for creativity, stress management, and meaningful connection.",["play","creativity","stress relief","wellbeing"]
"Building Resilience Through Self-Compassion","When facing difficulties, our instinct is often to criticize ourselves—thinking that toughness equals resilience. But research shows that self-compassion actually builds greater emotional strength and resilience than self-criticism ever could.\n\nSelf-compassion has three key components:\n\n1. Self-kindness: Treating yourself with care and understanding rather than harsh judgment.\n\n2. Common humanity: Recognizing that struggle and imperfection are part of shared human experience, not something that happens to you alone.\n\n3. Mindfulness: Holding painful thoughts and feelings in balanced awareness without over-identifying with them.\n\nPractical steps include:\n\n- Asking \"How would I speak to a friend facing this situation?\"\n- Placing a hand on your heart during moments of suffering\n- Developing a self-compassionate phrase to use when you're struggling\n- Writing a letter to yourself from the perspective of an unconditionally loving friend\n\nWith practice, self-compassion becomes not a way of avoiding challenges, but a more effective way of meeting them.","How treating yourself with the same kindness you'd offer a good friend can build greater emotional resilience than self-criticism.",["self-compassion","resilience","mental health","personal growth"]
"Finding Balance in a Hyper-Connected World","Our always-on digital culture presents unprecedented challenges to our attention, mental health, and sense of balance. Rather than all-or-nothing approaches, sustainable digital wellness comes from thoughtful integration of technology.\n\nStrategies for digital balance include:\n\n1. Intention setting: Begin digital activities with a clear purpose rather than defaulting to mindless scrolling.\n\n2. Time boundaries: Create tech-free times (mornings, meals, bedtime) and spaces (bedroom, nature outings).\n\n3. Notification audit: Disable all non-essential notifications to reduce constant interruptions.\n\n4. Digital Sabbath: Consider a regular 24-hour period of digital disconnection.\n\n5. Social media curation: Regularly assess which accounts enhance versus deplete your wellbeing.\n\n6. Physical reminders: Use analog tools like paper books, watches, and alarm clocks to reduce smartphone dependence.\n\nThe goal isn't digital minimalism but digital intentionality—using technology as a tool that serves your values rather than undermines them.","Practical strategies for maintaining wellbeing and presence in an era of constant connectivity and digital distraction.",["digital wellbeing","balance","technology","mindfulness"]
